# name: test/sql/bridge/virtual_catalog_routing.test
# description: operations route by entry origin inside one virtual_catalog schema
# group: [bridge]

require virtual_catalog_bridge

statement ok
CREATE TABLE memory.main.users(id INTEGER PRIMARY KEY, name VARCHAR);

statement ok
INSERT INTO memory.main.users VALUES (1, 'a'), (2, 'b');

statement ok
CREATE TABLE memory.main.logs(id INTEGER PRIMARY KEY, msg VARCHAR);

statement ok
INSERT INTO memory.main.logs VALUES (1, 'boot');

statement ok
SELECT bridge_register_source('ws_b', 'memory', 'tok_ws_b');

statement ok
SELECT bridge_policy('ws_b', 'main.users', v, 'true', c) FROM (VALUES ('select', NULL), ('insert', 'true'), ('update', NULL), ('delete', NULL)) _(v, c);

statement ok
SELECT bridge_policy('ws_b', 'main.logs', 'select', 'true');

statement ok
ATTACH '' AS ws (TYPE virtual_catalog_bridge, ID 'ws_b', TOKEN 'tok_ws_b');

# Native entries are created into the schema the bridge already serves.
statement ok
CREATE TABLE ws.main.local(x INTEGER PRIMARY KEY, tag VARCHAR);

statement ok
CREATE TABLE ws.main.local2(y INTEGER);

statement ok
CREATE VIEW ws.main.localv AS SELECT 1 AS z;

# ---------------------------------------------------------------------------
# SELECT routes to the entry's own origin; native and bridged entries join.
# ---------------------------------------------------------------------------

statement ok
INSERT INTO ws.main.local VALUES (1, 'first'), (2, 'second');

query IT
SELECT * FROM ws.main.users ORDER BY id;
----
1	a
2	b

query ITT
SELECT u.id, u.name, l.tag FROM ws.main.users u JOIN ws.main.local l ON u.id = l.x ORDER BY u.id;
----
1	a	first
2	b	second

# Tables absent from the permission map are not exposed at all.
statement ok
CREATE TABLE memory.main.secret(id INTEGER PRIMARY KEY);

statement error
SELECT * FROM ws.main.secret;
----
does not exist

# ---------------------------------------------------------------------------
# Writes route to the source and land there, not in the target catalog.
# ---------------------------------------------------------------------------

statement ok
INSERT INTO ws.main.users VALUES (3, 'c');

statement ok
UPDATE ws.main.users SET name = 'z' WHERE id = 1;

statement ok
DELETE FROM ws.main.users WHERE id = 2;

query IT
SELECT * FROM memory.main.users ORDER BY id;
----
1	z
3	c

# Same rows read back through the bridge -- no snapshot, always the source's latest committed data.
query IT
SELECT * FROM ws.main.users ORDER BY id;
----
1	z
3	c

# A READ table is a table entry like any other, so all three write paths bind and are then refused
# by the per-verb grant check. The message names the verb and the bridge, which is what a client
# needs to tell a missing grant apart from a missing table.
statement error
INSERT INTO ws.main.logs VALUES (2, 'nope');
----
does not have 'insert' permission

statement error
UPDATE ws.main.logs SET msg = 'nope';
----
does not have 'update' permission

statement error
DELETE FROM ws.main.logs WHERE id = 1;
----
does not have 'delete' permission

# Native entries in the same schema keep full native semantics.
statement ok
UPDATE ws.main.local SET tag = 'edited' WHERE x = 1;

query IT
SELECT * FROM ws.main.local ORDER BY x;
----
1	edited
2	second

# ---------------------------------------------------------------------------
# DDL: refused on bridge entries without the verb, native on native ones.
# ---------------------------------------------------------------------------

statement error
ALTER TABLE ws.main.users ADD COLUMN q INTEGER;
----
'users' does not have 'alter' permission

statement error
DROP TABLE ws.main.users;
----
'users' does not have 'drop' permission

statement ok
ALTER TABLE ws.main.local ADD COLUMN extra INTEGER;

query I
SELECT len(columns) FROM bridge_table_describe('ws', schema := 'main', "table" := 'local');
----
3

statement ok
DROP TABLE ws.main.local2;

statement ok
DROP VIEW ws.main.localv;

# Transactions are native for native entries.
statement ok
BEGIN;

statement ok
INSERT INTO ws.main.local VALUES (3, 'rolled back', NULL);

statement ok
ROLLBACK;

query I
SELECT count(*) FROM ws.main.local;
----
2

# ---------------------------------------------------------------------------
# Teardown takes the whole catalog: the bridged names and the native ones it hosted.
# ---------------------------------------------------------------------------

statement ok
DETACH ws;

statement error
SELECT * FROM ws.main.users;
----
does not exist

statement error
SELECT count(*) FROM ws.main.local;
----
does not exist
